{
  "framework_id": "product-management/product-intake",
  "created_at": "2026-08-21T15:00:32Z",
  "updated_at": "2026-08-21T15:18:20Z",
  "feedback_count": 0,
  "signal_count": 2,
  "accepted_runs": 0,
  "rejected_runs": 0,
  "passing_signals": 2,
  "failing_signals": 0,
  "learning_ready": false,
  "learning_status": "evidence_in_progress",
  "learning_blockers": [
    "No feedback entries"
  ]
}
