{
  "framework_id": "project-management/delta-specification",
  "created_at": "2026-08-21T15:00:32Z",
  "updated_at": "2026-08-21T15:11:47.224Z",
  "feedback_count": 0,
  "signal_count": 1,
  "accepted_runs": 0,
  "rejected_runs": 0,
  "passing_signals": 1,
  "failing_signals": 0,
  "learning_ready": false,
  "learning_status": "evidence_in_progress",
  "learning_blockers": [
    "No feedback entries"
  ]
}
